{
  "schema": "deepsuck.core.scam-scripts/v1",
  "version": "1.0.0",
  "updated": "2026-10-18",
  "license": "CC-BY-4.0",
  "licenseUrl": "https://creativecommons.org/licenses/by/4.0/legalcode",
  "attribution": "DeepSuck (deepsuck.si)",
  "comment": "诈骗话术语料（骗子侧）。7 类 × 5 阶段，每条都是据公开材料归纳后用自己的话重写的句子，不复制原文；号码、账户、网址一律用 {占位符}（见 placeholders，示例值均为虚构）。sourceType / sourceLabel 标明依据强度：只有确实对应某一典型案例、通报段落或数据集条目的才标注案例 / 通报 / 数据集，并用 sourceRef 指明是哪一个；其余据多篇公开反诈宣传归纳的一律标“据公开反诈宣传改写”，sourceIds 为参考来源。stage 与 corpus/scripts/*.yaml 的阶段 id 一致，phase 为统一的 5 阶段。",
  "usage": "仅限防御用途：训练与评测“拖住”机器人、话术识别、反诈宣传。",
  "thirdPartyNotice": "sources[].license 写明各来源的许可。TeleAntiFraud（Apache-2.0，Copyright 2025 Zhiming Ma）只借鉴话术结构并完全重写；政府与法院公开页面版权归原发布方，本库只概括其中描述的作案手法事实并重写，不复制原文。",
  "phases": [
    {
      "id": "opening",
      "name": "开场",
      "desc": "报身份、抛出由头（退款、涉案、加错好友、兼职、贷款等）"
    },
    {
      "id": "trust",
      "name": "建立信任",
      "desc": "核对个人信息、报工号、嘘寒问暖、小额返利、展示截图"
    },
    {
      "id": "pressure",
      "name": "施压",
      "desc": "损失威胁、时限、保密隔离、沉没成本、伪造文书或凭证"
    },
    {
      "id": "request",
      "name": "索要钱款/信息",
      "desc": "要验证码、卡号、余额、身份证照片，诱导下载 APP、共享屏幕、借款或充值"
    },
    {
      "id": "payout",
      "name": "收款指令",
      "desc": "给出收款账户、钱包地址、网址或联系方式，要求转账并删除记录"
    }
  ],
  "sourceTypes": {
    "court_case": {
      "label": "据法院公开典型案例改写",
      "comment": "条目对应法院公开发布的某一典型案例（sourceRef 指明第几个案例），按其案情描述改写；不是判决书原文。"
    },
    "police_case": {
      "label": "据公开典型案例改写",
      "comment": "条目对应公安 / 网信部门通报中的某一具体典型案例（sourceRef 指明）。"
    },
    "police_bulletin": {
      "label": "据公安机关公开通报改写",
      "comment": "条目对应公安机关某篇通报中列出的话术或提示（sourceRef 指明段落），不对应具体案件。"
    },
    "dataset": {
      "label": "据公开数据集改写",
      "comment": "条目对应公开数据集中的某一条对话（sourceRef 为条目名，sourceUrls 指向该文件）。"
    },
    "awareness": {
      "label": "据公开反诈宣传改写",
      "comment": "据多篇公开反诈宣传、类型通报归纳改写，不对应某一具体案件；sourceIds 为参考来源。"
    }
  },
  "docTypes": {
    "police_release": "公安 / 网信部门公开发布",
    "official_handbook": "官方反诈宣传手册",
    "procuratorate": "检察机关公开发布",
    "court": "法院公开典型案例 / 裁判报道",
    "dataset": "公开数据集",
    "project_corpus": "本项目既有语料"
  },
  "placeholders": {
    "银行卡": {
      "intel": "bank",
      "example": "6200 0000 0000 0000 000"
    },
    "户名": {
      "intel": "name",
      "example": "王某"
    },
    "手机号": {
      "intel": "phone",
      "example": "100 0000 0001"
    },
    "网址": {
      "intel": "url",
      "example": "https://refund-kefu.example/dl"
    },
    "微信号": {
      "intel": "wechat",
      "example": "demo_wx_example"
    },
    "QQ号": {
      "intel": "qq",
      "example": "10000"
    },
    "钱包地址": {
      "intel": "wallet",
      "example": "TDemoExampleAddressNotReal"
    },
    "APP名": {
      "intel": "app",
      "example": "示例·安心退"
    },
    "机构": {
      "intel": null,
      "example": "某平台 / 某银行 / 市公安局（泛称）"
    },
    "姓氏": {
      "intel": null,
      "example": "王"
    },
    "金额": {
      "intel": null,
      "example": "两千元"
    },
    "工号": {
      "intel": null,
      "example": "A1234"
    }
  },
  "sources": [
    {
      "id": "mps-2022-five",
      "title": "公安部公布五类高发电信网络诈骗案件",
      "publisher": "公安部（共产党员网转载）",
      "date": "2022-05-11",
      "url": "https://www.12371.cn/2022/05/11/ARTI1652253767367245.shtml",
      "license": "未声明（公开发布页面，版权归原发布方）",
      "usage": "只取公开通报 / 案例中描述的诈骗手法与话术套路这一事实层面信息，全部用自己的话重写；不复制原文，不保留姓名、地点、金额组合、案号、号码等可识别细节。",
      "accessed": "2026-10-18",
      "docType": "police_release"
    },
    {
      "id": "mps-2023-ten",
      "title": "公安部：十大电信网络诈骗类型高发 占比近80%",
      "publisher": "公安部（新华网报道）",
      "date": "2023-06-15",
      "url": "http://www.news.cn/politics/2023-06/15/c_1212199354.htm",
      "license": "未声明（公开发布页面，版权归原发布方）",
      "usage": "只取公开通报 / 案例中描述的诈骗手法与话术套路这一事实层面信息，全部用自己的话重写；不复制原文，不保留姓名、地点、金额组合、案号、号码等可识别细节。",
      "accessed": "2026-10-18",
      "docType": "police_release"
    },
    {
      "id": "mps-2025-handbook",
      "title": "2025版防范电信网络诈骗宣传手册",
      "publisher": "公安部刑侦局、国家反诈中心",
      "date": "2025-06-18",
      "url": "https://www.gov.cn/lianbo/bumen/202506/content_7028568.htm",
      "altUrls": [
        "https://fr.china-embassy.gov.cn/zgzfg/zgsg/lsqwc/202601/P020260121816688069095.pdf"
      ],
      "license": "未声明（公开发布页面，版权归原发布方）",
      "usage": "只取公开通报 / 案例中描述的诈骗手法与话术套路这一事实层面信息，全部用自己的话重写；不复制原文，不保留姓名、地点、金额组合、案号、号码等可识别细节。",
      "accessed": "2026-10-18",
      "docType": "official_handbook"
    },
    {
      "id": "mps-2025-shopping",
      "title": "公安部网安局发布网购消费诈骗典型案例",
      "publisher": "公安部网安局（央视网报道）",
      "date": "2025-06-18",
      "url": "https://news.cctv.com/2025/06/18/ARTIyynY2cbTUYzhL9aehole250618.shtml",
      "license": "未声明（公开发布页面，版权归原发布方）",
      "usage": "只取公开通报 / 案例中描述的诈骗手法与话术套路这一事实层面信息，全部用自己的话重写；不复制原文，不保留姓名、地点、金额组合、案号、号码等可识别细节。",
      "accessed": "2026-10-18",
      "docType": "police_release"
    },
    {
      "id": "cac-2022-cases",
      "title": "国家网信办曝光一批电信网络诈骗典型案例",
      "publisher": "国家网信办（会同公安部等）",
      "date": "2022-04-14",
      "url": "https://www.cac.gov.cn/2022-04/14/c_1651546285887220.htm",
      "license": "未声明（公开发布页面，版权归原发布方）",
      "usage": "只取公开通报 / 案例中描述的诈骗手法与话术套路这一事实层面信息，全部用自己的话重写；不复制原文，不保留姓名、地点、金额组合、案号、号码等可识别细节。",
      "accessed": "2026-10-18",
      "docType": "police_release"
    },
    {
      "id": "hebei-2021",
      "title": "河北省公安厅发布五类高发电信网络诈骗犯罪典型案例",
      "publisher": "河北省公安厅（澎湃新闻转载）",
      "date": "2021-04",
      "url": "https://m.thepaper.cn/baijiahao_12254985",
      "license": "未声明（公开发布页面，版权归原发布方）",
      "usage": "只取公开通报 / 案例中描述的诈骗手法与话术套路这一事实层面信息，全部用自己的话重写；不复制原文，不保留姓名、地点、金额组合、案号、号码等可识别细节。",
      "accessed": "2026-10-18",
      "docType": "police_release"
    },
    {
      "id": "jiangmen-boss",
      "title": "假“领导”，真“骗子”！新会公安为公司挽损19万",
      "publisher": "江门市公安局",
      "date": "2024",
      "url": "https://www.jiangmen.gov.cn/jmgaj/gkmlpt/content/3/3114/post_3114131.html",
      "license": "未声明（公开发布页面，版权归原发布方）",
      "usage": "只取公开通报 / 案例中描述的诈骗手法与话术套路这一事实层面信息，全部用自己的话重写；不复制原文，不保留姓名、地点、金额组合、案号、号码等可识别细节。",
      "accessed": "2026-10-18",
      "docType": "police_release"
    },
    {
      "id": "jiangsu-boss-2024",
      "title": "防范提示 财务人员警惕“经理”转账指令",
      "publisher": "江苏省公安厅",
      "date": "2024-11-14",
      "url": "https://gat.jiangsu.gov.cn/art/2024/11/14/art_89956_11418671.html",
      "license": "未声明（公开发布页面，版权归原发布方）",
      "usage": "只取公开通报 / 案例中描述的诈骗手法与话术套路这一事实层面信息，全部用自己的话重写；不复制原文，不保留姓名、地点、金额组合、案号、号码等可识别细节。",
      "accessed": "2026-10-18",
      "docType": "police_release"
    },
    {
      "id": "hubei-boss-2021",
      "title": "“领导”加微信让你汇款？“冒充领导”诈骗的升级版来了",
      "publisher": "湖北省公安厅（中新网报道）",
      "date": "2021-01-25",
      "url": "http://gat.hubei.gov.cn/bmdt/dtyw/202101/t20210125_3303901.shtml",
      "license": "未声明（公开发布页面，版权归原发布方）",
      "usage": "只取公开通报 / 案例中描述的诈骗手法与话术套路这一事实层面信息，全部用自己的话重写；不复制原文，不保留姓名、地点、金额组合、案号、号码等可识别细节。",
      "accessed": "2026-10-18",
      "docType": "police_release"
    },
    {
      "id": "sz-campus-2022",
      "title": "收到“注销校园贷、变更贷款人身份信息”？这是怎么回事？",
      "publisher": "深圳市公安局（深圳市反电信网络诈骗中心）",
      "date": "2022-12-10",
      "url": "https://ga.sz.gov.cn/JMHD/YWZSK/XJGL_ZS/content/post_10332097.html",
      "license": "未声明（公开发布页面，版权归原发布方）",
      "usage": "只取公开通报 / 案例中描述的诈骗手法与话术套路这一事实层面信息，全部用自己的话重写；不复制原文，不保留姓名、地点、金额组合、案号、号码等可识别细节。",
      "accessed": "2026-10-18",
      "docType": "police_release"
    },
    {
      "id": "local-police-2024",
      "title": "电诈案件典型案例——冒充公检法类",
      "publisher": "地方政府信息公开（转载公安机关案例）",
      "date": "2024-03-13",
      "url": "https://www.bypc.gov.cn/zfxxgk/bmdwxzjd/xzjd/ghz/fdzdgknr/cwgk/hgc/cwgk/art/2024/art_1a443ab6561a47d5bb72cbb2e8a4daa3.html",
      "license": "未声明（公开发布页面，版权归原发布方）",
      "usage": "只取公开通报 / 案例中描述的诈骗手法与话术套路这一事实层面信息，全部用自己的话重写；不复制原文，不保留姓名、地点、金额组合、案号、号码等可识别细节。",
      "accessed": "2026-10-18",
      "docType": "police_release"
    },
    {
      "id": "spp-topic-2021",
      "title": "充分履行法律监督职能 依法严惩电信网络诈骗犯罪（专题）",
      "publisher": "最高人民检察院",
      "date": "2021",
      "url": "https://www.spp.gov.cn/spp/dxwlzp2021/index.shtml",
      "license": "未声明（公开发布页面，版权归原发布方）",
      "usage": "只取公开通报 / 案例中描述的诈骗手法与话术套路这一事实层面信息，全部用自己的话重写；不复制原文，不保留姓名、地点、金额组合、案号、号码等可识别细节。",
      "accessed": "2026-10-18",
      "docType": "procuratorate"
    },
    {
      "id": "spp-2018-notice",
      "title": "不法分子假冒检察机关实施电信网络诈骗犯罪 最高检提醒广大群众谨防上当受骗",
      "publisher": "最高人民检察院（新华社报道）",
      "date": "2018-01-27",
      "url": "https://www.gov.cn/xinwen/2018-01/27/content_5261348.htm",
      "license": "未声明（公开发布页面，版权归原发布方）",
      "usage": "只取公开通报 / 案例中描述的诈骗手法与话术套路这一事实层面信息，全部用自己的话重写；不复制原文，不保留姓名、地点、金额组合、案号、号码等可识别细节。",
      "accessed": "2026-10-18",
      "docType": "procuratorate"
    },
    {
      "id": "spp-2023-cases",
      "title": "最高检发布检察机关依法惩治电信网络诈骗及其关联犯罪典型案例",
      "publisher": "最高人民检察院",
      "date": "2023-11-30",
      "url": "https://www.spp.gov.cn/xwfbh/wsfbt/202311/t20231130_635188.shtml",
      "license": "未声明（公开发布页面，版权归原发布方）",
      "usage": "只取公开通报 / 案例中描述的诈骗手法与话术套路这一事实层面信息，全部用自己的话重写；不复制原文，不保留姓名、地点、金额组合、案号、号码等可识别细节。",
      "accessed": "2026-10-18",
      "docType": "procuratorate"
    },
    {
      "id": "spp-2023-credit",
      "title": "最高检公安部联合发布虚假征信类诈骗典型案例及防范建议",
      "publisher": "最高人民检察院、公安部",
      "date": "2023-01-19",
      "url": "https://www.spp.gov.cn/spp/xwfbh/wsfbt/202301/t20230119_599532.shtml",
      "license": "未声明（公开发布页面，版权归原发布方）",
      "usage": "只取公开通报 / 案例中描述的诈骗手法与话术套路这一事实层面信息，全部用自己的话重写；不复制原文，不保留姓名、地点、金额组合、案号、号码等可识别细节。",
      "accessed": "2026-10-18",
      "docType": "procuratorate"
    },
    {
      "id": "court-2025-cases",
      "title": "最高法发布电信网络诈骗及其关联犯罪典型案例（7件）",
      "publisher": "最高人民法院",
      "date": "2025-02-24",
      "url": "https://www.court.gov.cn/zixun/xiangqing/455701.html",
      "license": "未声明（公开发布页面，版权归原发布方）",
      "usage": "只取公开通报 / 案例中描述的诈骗手法与话术套路这一事实层面信息，全部用自己的话重写；不复制原文，不保留姓名、地点、金额组合、案号、号码等可识别细节。",
      "accessed": "2026-10-18",